{"contract":"mantra.workbench/1","revision":"7fca2cbb87ddfcbf","engine":{"mantra":"0.1.0-SNAPSHOT","normein":"0a3ae1de"},"data":{"address":{"node":"tarifliche-est"},"label":"Tarifliche Einkommensteuer","kind":"line","formula":{"text":"(est-tarif zu-versteuerndes-einkommen zusammen)","location":{"document":"schema.mantra","line":146,"column":55,"startOffset":10046,"endOffset":10093}},"result":{"value":{"n":"15676"},"display":"15.676,00","rounding":null},"status":"active","reason":null,"steps":[{"text":"(/ zve 2)","value":{"n":"41608.95"},"display":"41.608,95","location":{"document":"schema.mantra","line":93,"column":40,"startOffset":6387,"endOffset":6396}},{"text":"(decimal/floor zve 0)","value":{"n":"41608"},"display":"41.608,00","location":{"document":"schema.mantra","line":81,"column":13,"startOffset":5814,"endOffset":5835}},{"text":"(- x tarif-g2)","value":{"n":"24165"},"display":"24.165,00","location":{"document":"schema.mantra","line":86,"column":38,"startOffset":6030,"endOffset":6044}},{"text":"(/ (- x tarif-g2) 10000)","value":{"n":"2.4165"},"display":"2,42","location":{"document":"schema.mantra","line":86,"column":35,"startOffset":6027,"endOffset":6051}},{"text":"(* tarif-a3 z)","value":{"n":"426.850560"},"display":"426,85","location":{"document":"schema.mantra","line":86,"column":70,"startOffset":6062,"endOffset":6076}},{"text":"(+ (* tarif-a3 z) 2397)","value":{"n":"2823.850560"},"display":"2.823,85","location":{"document":"schema.mantra","line":86,"column":67,"startOffset":6059,"endOffset":6082}},{"text":"(* (+ (* tarif-a3 z) 2397) z)","value":{"n":"6823.8348782400"},"display":"6.823,83","location":{"document":"schema.mantra","line":86,"column":64,"startOffset":6056,"endOffset":6085}},{"text":"(+ (* (+ (* tarif-a3 z) 2397) z) tarif-c3)","value":{"n":"7838.9648782400"},"display":"7.838,96","location":{"document":"schema.mantra","line":86,"column":61,"startOffset":6053,"endOffset":6095}},{"text":"(let [z (/ (- x tarif-g2) 10000)] (+ (* (+ (* tarif-a3 z) 2397) z) tarif-c3))","value":{"n":"7838.9648782400"},"display":"7.838,96","location":{"document":"schema.mantra","line":86,"column":27,"startOffset":6019,"endOffset":6096}},{"text":"(cond\n          (<= x tarif-gfb) 0\n          (<= x tarif-g2) (let [y (/ (- x tarif-gfb) 10000)] (* (+ (* tarif-a2 y) 1400) y))\n          (<= x tarif-g3) (let [z (/ (- x tarif-g2) 10000)] (+ (* (+ (* tarif-a3 z) 2397) z) tarif-c3))\n          (<= x tarif-g4) (- (* 0.42 x) tarif-c4)\n          :else (- (* 0.45 x) tarif-c5))","value":{"n":"7838.9648782400"},"display":"7.838,96","location":{"document":"schema.mantra","line":83,"column":9,"startOffset":5866,"endOffset":6187}},{"text":"(cond\n          (<= x tarif-gfb) 0\n          (<= x tarif-g2) (let [y (/ (- x tarif-gfb) 10000)] (* (+ (* tarif-a2 y) 1400) y))\n          (<= x tarif-g3) (let [z (/ (- x tarif-g2) 10000)] (+ (* (+ (* tarif-a3 z) 2397) z) tarif-c3))\n          (<= x tarif-g4) (- (* 0.42 x) tarif-c4)\n          :else (- (* 0.45 x) tarif-c5))","value":{"n":"7838.9648782400"},"display":"7.838,96","location":{"document":"schema.mantra","line":83,"column":9,"startOffset":5866,"endOffset":6187}},{"text":"(cond\n          (<= x tarif-gfb) 0\n          (<= x tarif-g2) (let [y (/ (- x tarif-gfb) 10000)] (* (+ (* tarif-a2 y) 1400) y))\n          (<= x tarif-g3) (let [z (/ (- x tarif-g2) 10000)] (+ (* (+ (* tarif-a3 z) 2397) z) tarif-c3))\n          (<= x tarif-g4) (- (* 0.42 x) tarif-c4)\n          :else (- (* 0.45 x) tarif-c5))","value":{"n":"7838.9648782400"},"display":"7.838,96","location":{"document":"schema.mantra","line":83,"column":9,"startOffset":5866,"endOffset":6187}},{"text":"(decimal/floor\n        (cond\n          (<= x tarif-gfb) 0\n          (<= x tarif-g2) (let [y (/ (- x tarif-gfb) 10000)] (* (+ (* tarif-a2 y) 1400) y))\n          (<= x tarif-g3) (let [z (/ (- x tarif-g2) 10000)] (+ (* (+ (* tarif-a3 z) 2397) z) tarif-c3))\n          (<= x tarif-g4) (- (* 0.42 x) tarif-c4)\n          :else (- (* 0.45 x) tarif-c5))\n        0)","value":{"n":"7838"},"display":"7.838,00","location":{"document":"schema.mantra","line":82,"column":7,"startOffset":5843,"endOffset":6198}},{"text":"(let [x (decimal/floor zve 0)]\n      (decimal/floor\n        (cond\n          (<= x tarif-gfb) 0\n          (<= x tarif-g2) (let [y (/ (- x tarif-gfb) 10000)] (* (+ (* tarif-a2 y) 1400) y))\n          (<= x tarif-g3) (let [z (/ (- x tarif-g2) 10000)] (+ (* (+ (* tarif-a3 z) 2397) z) tarif-c3))\n          (<= x tarif-g4) (- (* 0.42 x) tarif-c4)\n          :else (- (* 0.45 x) tarif-c5))\n        0))","value":{"n":"7838"},"display":"7.838,00","location":{"document":"schema.mantra","line":81,"column":5,"startOffset":5806,"endOffset":6199}},{"text":"(est-grundtarif (/ zve 2))","value":{"n":"7838"},"display":"7.838,00","location":{"document":"schema.mantra","line":93,"column":24,"startOffset":6371,"endOffset":6397}},{"text":"(* 2 (est-grundtarif (/ zve 2)))","value":{"n":"15676"},"display":"15.676,00","location":{"document":"schema.mantra","line":93,"column":19,"startOffset":6366,"endOffset":6398}},{"text":"(if splitting (* 2 (est-grundtarif (/ zve 2))) (est-grundtarif zve))","value":{"n":"15676"},"display":"15.676,00","location":{"document":"schema.mantra","line":93,"column":5,"startOffset":6352,"endOffset":6420}}],"branches":[{"text":"(let [z (/ (- x tarif-g2) 10000)] (+ (* (+ (* tarif-a3 z) 2397) z) tarif-c3))","selected":true,"location":{"document":"schema.mantra","line":86,"column":27,"startOffset":6019,"endOffset":6096}},{"text":"(* 2 (est-grundtarif (/ zve 2)))","selected":true,"location":{"document":"schema.mantra","line":93,"column":19,"startOffset":6366,"endOffset":6398}}],"references":[{"address":{"node":"tarif-a2"},"label":"Koeffizient y (Zone 2)","value":{"n":"932.3"},"display":"932,30","kind":"aligned","origin":"schema"},{"address":{"node":"tarif-a3"},"label":"Koeffizient z (Zone 3)","value":{"n":"176.64"},"display":"176,64","kind":"aligned","origin":"schema"},{"address":{"node":"tarif-c3"},"label":"Konstante Zone 3","value":{"n":"1015.13"},"display":"1.015,13","kind":"aligned","origin":"schema"},{"address":{"node":"tarif-c4"},"label":"Abzug Zone 4","value":{"n":"10911.92"},"display":"10.911,92","kind":"aligned","origin":"schema"},{"address":{"node":"tarif-c5"},"label":"Abzug Zone 5","value":{"n":"19246.67"},"display":"19.246,67","kind":"aligned","origin":"schema"},{"address":{"node":"tarif-g2"},"label":"Ende Zone 2","value":{"n":"17443"},"display":"17.443,00","kind":"aligned","origin":"schema"},{"address":{"node":"tarif-g3"},"label":"Ende Zone 3","value":{"n":"68480"},"display":"68.480,00","kind":"aligned","origin":"schema"},{"address":{"node":"tarif-g4"},"label":"Ende Zone 4","value":{"n":"277825"},"display":"277.825,00","kind":"aligned","origin":"schema"},{"address":{"node":"tarif-gfb"},"label":"Grundfreibetrag (Ende Zone 1)","value":{"n":"12096"},"display":"12.096,00","kind":"aligned","origin":"schema"},{"address":{"node":"zu-versteuerndes-einkommen"},"label":"Zu versteuerndes Einkommen","value":{"n":"83217.90"},"display":"83.217,90","kind":"aligned","origin":null},{"address":{"node":"zusammen"},"label":"Zusammenveranlagung (Splittingverfahren)","value":true,"display":"✓","kind":"aligned","origin":null}],"parts":[],"options":[],"reference":"§ 32a Abs. 1, 5 EStG","truncated":false}}
