{"contract":"mantra.workbench/1","revision":"16703e5820f10494","engine":{"mantra":"0.1.0-SNAPSHOT","normein":"0a3ae1de"},"data":{"address":{"node":"allocation-key","coord":["B"]},"label":"Pro-rata allocation factor","kind":"line","formula":{"text":"(decimal/divide weighted-amount (dim/sum all.weighted-amount) 6)","location":{"document":"schema.mantra","line":43,"column":7,"startOffset":2505,"endOffset":2569}},"result":{"value":{"n":"0.375000"},"display":"37.5 %","rounding":null},"status":"active","reason":null,"steps":[{"text":"(dim/sum all.weighted-amount)","value":{"n":"800.0000"},"display":"80,000.0 %","location":{"document":"schema.mantra","line":43,"column":39,"startOffset":2537,"endOffset":2566}}],"branches":[],"references":[{"address":{"node":"weighted-amount","coord":["B"]},"label":"Carrying amount after weighting","value":{"n":"300.0000"},"display":"300","kind":"aligned","origin":null},{"address":{"node":"all.weighted-amount"},"label":"Carrying amount after weighting","value":{"map":[[{"kw":"A"},{"n":"100.0000"}],[{"kw":"B"},{"n":"300.0000"}],[{"kw":"C"},{"n":"400.0000"}]]},"display":"A: 100, B: 300, C: 400","kind":"all","origin":null}],"parts":[],"options":[],"reference":null,"truncated":false}}
