{"contract":"mantra.workbench/1","revision":"a51acd9aeab8f837","engine":{"mantra":"0.1.0-SNAPSHOT","normein":"be7648b5"},"data":{"sheets":[{"name":"Overview","rows":26,"columns":5},{"name":"1 Schedule 1 – Allocation of th","rows":11,"columns":8},{"name":"2 Schedule 2 – Impairment test","rows":9,"columns":8},{"name":"3 Schedule 3 – Allocation of th","rows":8,"columns":8},{"name":"4 Schedule 4 – Impairment test","rows":12,"columns":5},{"name":"5 Schedule 5 – Summary","rows":9,"columns":4},{"name":"Inputs","rows":17,"columns":8},{"name":"Parameters","rows":4,"columns":4},{"name":"Helper calculations","rows":1,"columns":1}],"selectedSheet":"Parameters","preview":{"rows":4,"columns":4,"truncated":false,"cells":[{"address":"A1","kind":"string","value":"Parameters (blue: editable)","formula":null},{"address":"A3","kind":"string","value":"Description","formula":null},{"address":"B3","kind":"string","value":"Name","formula":null},{"address":"C3","kind":"string","value":"Value","formula":null},{"address":"D3","kind":"string","value":"Reference","formula":null},{"address":"A4","kind":"string","value":"Rounding scale of allocations","formula":null},{"address":"B4","kind":"string","value":"rounding","formula":null},{"address":"C4","kind":"numeric","value":"0.0","formula":null},{"address":"D4","kind":"string","value":"","formula":null}]},"names":[{"name":"_xlnm.Print_Titles","refersTo":"'1 Schedule 1 – Allocation of th'!$4:$4"},{"name":"_xlnm.Print_Titles","refersTo":"'2 Schedule 2 – Impairment test'!$4:$4"},{"name":"_xlnm.Print_Titles","refersTo":"'3 Schedule 3 – Allocation of th'!$4:$4"},{"name":"_xlnm.Print_Titles","refersTo":"'4 Schedule 4 – Impairment test'!$4:$4"},{"name":"_xlnm.Print_Titles","refersTo":"'5 Schedule 5 – Summary'!$4:$4"},{"name":"carrying_amount__A","refersTo":"'1 Schedule 1 – Allocation of th'!$B$5"},{"name":"carrying_amount__B","refersTo":"'1 Schedule 1 – Allocation of th'!$C$5"},{"name":"carrying_amount__C","refersTo":"'1 Schedule 1 – Allocation of th'!$D$5"},{"name":"carrying_amount","refersTo":"'1 Schedule 1 – Allocation of th'!$B$5:$D$5"},{"name":"remaining_life__A","refersTo":"'1 Schedule 1 – Allocation of th'!$B$6"},{"name":"remaining_life__B","refersTo":"'1 Schedule 1 – Allocation of th'!$C$6"},{"name":"remaining_life__C","refersTo":"'1 Schedule 1 – Allocation of th'!$D$6"},{"name":"remaining_life","refersTo":"'1 Schedule 1 – Allocation of th'!$B$6:$D$6"},{"name":"weighting__A","refersTo":"'1 Schedule 1 – Allocation of th'!$B$7"},{"name":"weighting__B","refersTo":"'1 Schedule 1 – Allocation of th'!$C$7"},{"name":"weighting__C","refersTo":"'1 Schedule 1 – Allocation of th'!$D$7"},{"name":"weighting","refersTo":"'1 Schedule 1 – Allocation of th'!$B$7:$D$7"},{"name":"weighted_amount__A","refersTo":"'1 Schedule 1 – Allocation of th'!$B$8"},{"name":"weighted_amount__B","refersTo":"'1 Schedule 1 – Allocation of th'!$C$8"},{"name":"weighted_amount__C","refersTo":"'1 Schedule 1 – Allocation of th'!$D$8"},{"name":"weighted_amount","refersTo":"'1 Schedule 1 – Allocation of th'!$B$8:$D$8"},{"name":"allocation_key__A","refersTo":"'1 Schedule 1 – Allocation of th'!$B$9"},{"name":"allocation_key__B","refersTo":"'1 Schedule 1 – Allocation of th'!$C$9"},{"name":"allocation_key__C","refersTo":"'1 Schedule 1 – Allocation of th'!$D$9"},{"name":"allocation_key","refersTo":"'1 Schedule 1 – Allocation of th'!$B$9:$D$9"},{"name":"corporate_share__A","refersTo":"'1 Schedule 1 – Allocation of th'!$B$10"},{"name":"corporate_share__B","refersTo":"'1 Schedule 1 – Allocation of th'!$C$10"},{"name":"corporate_share__C","refersTo":"'1 Schedule 1 – Allocation of th'!$D$10"},{"name":"corporate_share","refersTo":"'1 Schedule 1 – Allocation of th'!$B$10:$D$10"},{"name":"carrying_amount_allocated__A","refersTo":"'1 Schedule 1 – Allocation of th'!$B$11"},{"name":"carrying_amount_allocated__B","refersTo":"'1 Schedule 1 – Allocation of th'!$C$11"},{"name":"carrying_amount_allocated__C","refersTo":"'1 Schedule 1 – Allocation of th'!$D$11"},{"name":"carrying_amount_allocated","refersTo":"'1 Schedule 1 – Allocation of th'!$B$11:$D$11"},{"name":"tested_amount__A","refersTo":"'2 Schedule 2 – Impairment test'!$B$5"},{"name":"tested_amount__B","refersTo":"'2 Schedule 2 – Impairment test'!$C$5"},{"name":"tested_amount__C","refersTo":"'2 Schedule 2 – Impairment test'!$D$5"},{"name":"tested_amount","refersTo":"'2 Schedule 2 – Impairment test'!$B$5:$D$5"},{"name":"recoverable_amount__A","refersTo":"'2 Schedule 2 – Impairment test'!$B$6"},{"name":"recoverable_amount__B","refersTo":"'2 Schedule 2 – Impairment test'!$C$6"},{"name":"recoverable_amount__C","refersTo":"'2 Schedule 2 – Impairment test'!$D$6"},{"name":"recoverable_amount","refersTo":"'2 Schedule 2 – Impairment test'!$B$6:$D$6"},{"name":"impairment_loss__A","refersTo":"'2 Schedule 2 – Impairment test'!$B$9"},{"name":"impairment_loss__B","refersTo":"'2 Schedule 2 – Impairment test'!$C$9"},{"name":"impairment_loss__C","refersTo":"'2 Schedule 2 – Impairment test'!$D$9"},{"name":"impairment_loss","refersTo":"'2 Schedule 2 – Impairment test'!$B$9:$D$9"},{"name":"loss_to_goodwill__A","refersTo":"'3 Schedule 3 – Allocation of th'!$B$5"},{"name":"loss_to_goodwill__B","refersTo":"'3 Schedule 3 – Allocation of th'!$C$5"},{"name":"loss_to_goodwill__C","refersTo":"'3 Schedule 3 – Allocation of th'!$D$5"},{"name":"loss_to_goodwill","refersTo":"'3 Schedule 3 – Allocation of th'!$B$5:$D$5"},{"name":"loss_to_corporate__A","refersTo":"'3 Schedule 3 – Allocation of th'!$B$6"},{"name":"loss_to_corporate__B","refersTo":"'3 Schedule 3 – Allocation of th'!$C$6"},{"name":"loss_to_corporate__C","refersTo":"'3 Schedule 3 – Allocation of th'!$D$6"},{"name":"loss_to_corporate","refersTo":"'3 Schedule 3 – Allocation of th'!$B$6:$D$6"},{"name":"loss_to_own_assets__A","refersTo":"'3 Schedule 3 – Allocation of th'!$B$7"},{"name":"loss_to_own_assets__B","refersTo":"'3 Schedule 3 – Allocation of th'!$C$7"},{"name":"loss_to_own_assets__C","refersTo":"'3 Schedule 3 – Allocation of th'!$D$7"},{"name":"loss_to_own_assets","refersTo":"'3 Schedule 3 – Allocation of th'!$B$7:$D$7"},{"name":"loss_allocated__A","refersTo":"'3 Schedule 3 – Allocation of th'!$B$8"},{"name":"loss_allocated__B","refersTo":"'3 Schedule 3 – Allocation of th'!$C$8"},{"name":"loss_allocated__C","refersTo":"'3 Schedule 3 – Allocation of th'!$D$8"},{"name":"loss_allocated","refersTo":"'3 Schedule 3 – Allocation of th'!$B$8:$D$8"},{"name":"group_cgu_assets","refersTo":"'4 Schedule 4 – Impairment test'!$B$5"},{"name":"group_building","refersTo":"'4 Schedule 4 – Impairment test'!$B$6"},{"name":"group_research","refersTo":"'4 Schedule 4 – Impairment test'!$B$7"},{"name":"group_before","refersTo":"'4 Schedule 4 – Impairment test'!$B$8"},{"name":"group_step1_losses","refersTo":"'4 Schedule 4 – Impairment test'!$B$9"},{"name":"group_carrying_amount","refersTo":"'4 Schedule 4 – Impairment test'!$B$10"},{"name":"group_ra","refersTo":"'4 Schedule 4 – Impairment test'!$B$11"},{"name":"group_loss","refersTo":"'4 Schedule 4 – Impairment test'!$B$12"},{"name":"summary_goodwill","refersTo":"'5 Schedule 5 – Summary'!$B$5"},{"name":"summary_own","refersTo":"'5 Schedule 5 – Summary'!$B$6"},{"name":"summary_corporate","refersTo":"'5 Schedule 5 – Summary'!$B$7"},{"name":"summary_group","refersTo":"'5 Schedule 5 – Summary'!$B$8"},{"name":"total_impairment","refersTo":"'5 Schedule 5 – Summary'!$B$9"},{"name":"allocable_corporate","refersTo":"'Inputs'!$C$4"},{"name":"unallocable_corporate","refersTo":"'Inputs'!$C$13"},{"name":"group_recoverable_amount","refersTo":"'Inputs'!$C$14"},{"name":"weight_by_life","refersTo":"'Inputs'!$C$17"},{"name":"rounding","refersTo":"'Parameters'!$C$4"},{"name":"recoverable_amount__opt__viu__A","refersTo":"'2 Schedule 2 – Impairment test'!$B$7"},{"name":"recoverable_amount__opt__viu__B","refersTo":"'2 Schedule 2 – Impairment test'!$C$7"},{"name":"recoverable_amount__opt__viu__C","refersTo":"'2 Schedule 2 – Impairment test'!$D$7"},{"name":"recoverable_amount__opt__fvlcd__A","refersTo":"'2 Schedule 2 – Impairment test'!$B$8"},{"name":"recoverable_amount__opt__fvlcd__B","refersTo":"'2 Schedule 2 – Impairment test'!$C$8"},{"name":"recoverable_amount__opt__fvlcd__C","refersTo":"'2 Schedule 2 – Impairment test'!$D$8"},{"name":"cgus__C__remaining_life","refersTo":"'Inputs'!$F$9"},{"name":"cgus__B__remaining_life","refersTo":"'Inputs'!$F$8"},{"name":"cgus__A__remaining_life","refersTo":"'Inputs'!$F$7"},{"name":"cgus__A__id","refersTo":"'Inputs'!$B$7"},{"name":"cgus__A__carrying_amount","refersTo":"'Inputs'!$D$7"},{"name":"cgus__B__id","refersTo":"'Inputs'!$B$8"},{"name":"cgus__B__carrying_amount","refersTo":"'Inputs'!$D$8"},{"name":"cgus__C__id","refersTo":"'Inputs'!$B$9"},{"name":"cgus__C__carrying_amount","refersTo":"'Inputs'!$D$9"},{"name":"cgus__A__name","refersTo":"'Inputs'!$C$7"},{"name":"cgus__A__goodwill","refersTo":"'Inputs'!$E$7"},{"name":"cgus__B__name","refersTo":"'Inputs'!$C$8"},{"name":"cgus__B__goodwill","refersTo":"'Inputs'!$E$8"},{"name":"cgus__C__name","refersTo":"'Inputs'!$C$9"},{"name":"cgus__C__goodwill","refersTo":"'Inputs'!$E$9"},{"name":"cgus__C__fvlcd","refersTo":"'Inputs'!$H$9"},{"name":"cgus__B__fvlcd","refersTo":"'Inputs'!$H$8"},{"name":"cgus__A__fvlcd","refersTo":"'Inputs'!$H$7"},{"name":"cgus__C__value_in_use","refersTo":"'Inputs'!$G$9"},{"name":"cgus__B__value_in_use","refersTo":"'Inputs'!$G$8"},{"name":"cgus__A__value_in_use","refersTo":"'Inputs'!$G$7"}],"report":{"formulaCells":78,"inputCells":25,"names":106,"fallbacks":[],"evaluationErrors":[]}}}
