{"contract":"mantra.workbench/1","revision":"16703e5820f10494","engine":{"mantra":"0.1.0-SNAPSHOT","normein":"0a3ae1de"},"data":{"address":{"node":"all.weighted-amount"},"label":"Carrying amount after weighting","kind":"member-map","formula":null,"result":{"value":{"map":[[{"kw":"A"},{"n":"100.0000"}],[{"kw":"B"},{"n":"300.0000"}],[{"kw":"C"},{"n":"400.0000"}]]},"display":"A: 100, B: 300, C: 400","rounding":null},"status":"active","reason":null,"steps":[],"branches":[],"references":[{"address":{"node":"weighted-amount","coord":["A"]},"label":"Carrying amount after weighting","value":{"n":"100.0000"},"display":"100","kind":"member","origin":null},{"address":{"node":"weighted-amount","coord":["B"]},"label":"Carrying amount after weighting","value":{"n":"300.0000"},"display":"300","kind":"member","origin":null},{"address":{"node":"weighted-amount","coord":["C"]},"label":"Carrying amount after weighting","value":{"n":"400.0000"},"display":"400","kind":"member","origin":null}],"parts":[],"options":[],"reference":null,"truncated":false}}
