{"contract":"mantra.workbench/1","revision":"bdbac75969195b60","engine":{"mantra":"0.1.0-SNAPSHOT","normein":"0a3ae1de"},"data":{"parameters":[{"id":"allocation-scale","label":"Currency precision for cost allocation","reference":null,"layers":[{"layer":"schema","value":{"n":"2"},"declared":true},{"layer":"case","value":null,"declared":false}],"effective":{"value":{"n":"2"},"layer":"schema"}},{"id":"unit-scale","label":"Precision of unit-cost comparison","reference":null,"layers":[{"layer":"schema","value":{"n":"4"},"declared":true},{"layer":"case","value":null,"declared":false}],"effective":{"value":{"n":"4"},"layer":"schema"}}]}}
